{
  "profile": "agent-connector.anp-task.v1",
  "version": 1,
  "message_type": "task.completed",
  "task_id": "t-0001",
  "operation_id": "op-0001",
  "message_id": "m-0020",
  "seq": 7,
  "final": true,
  "payload": {
    "output": [{"type": "text", "text": "Q3 report summary: revenue up 15%"}]
  },
  "artifacts": [
    {
      "uri": "https://peer.example/artifacts/t-0001/summary.md",
      "mime_type": "text/markdown"
    }
  ]
}
